PDF File Name,Parsed Text
/content/drive/MyDrive/RecruitFlow/TestDataset/ADVOCATE/11174187.pdf,"RN / ASST. HEAD NURSE PRACTICE LEADER
Skills
care planning, Case Management, Home Health, Hospice, Infection control, injections, Nurse Manager, Oncology, scheduling, staff development,
Trauma, triage, tutoring, Urology
Experience
09/2010 to 12/2011
Company Name

Hired as ADON (Assistant Director of Nursing) for an 85 to 90 bed long term care of Mentally and Physically disabled children from 2
years to upper 20's with a few older individuals.
My job there included staffing of all the nurses monthly, setting up transportation for all outside MD office visits of the residents, monitoring
the 3 nursing units of day to day care and documentation of the residents, taking call as needed and twice a month being MOD for the entire
building ,I conducted in-services for the nursing staff and answered all pages during the day with questions or to oversee any critical changes
of residents and helped with decisions to transfer out to a hospital after speaking with the MD.Helped with staff nursing as needed.
Secured a Home Health position at ResCare located in Oak Park Illinois in 2015.
I made home visits overseeing clients overall health.
Did basic assessments and listened for any new complaints or change of status.
Would call clients doctor if needed or to inform him of a change in status.
Gave injections/ infusions as needed and participated in one clinical trial where all aspects of visit were timed and documented as per
protocal.
I am still registered with this agency but they have very few clients in need of an RN visit.
Most of their clients only need part time CAN visits.
Secured an RN position in July 2016 at Best Home Health where I did home visits part time.
The jobs that were available for part time were minimal so took myself off their roster.
In the fall of 2016 worked for Maxim Home Health asking for part time for Infusion cases.
Again I was promised infusion cases but what were available Were ones 40 miles away and they didn't cover milage.
I still am on their roster but rarely called.
Currently looking for Part Time RN on line or going into a facility not more than 30 minute drive to do tutoring or online triage or willing to
learn Case Management or PT Oncology/Hospice Additional professional activities Was OCN certified in past Was Med / Surg certified in
past and plan to recertify in future.
Was team nurse of North Shore Youth Baseball League for 4 years References Dr.
Emil Totonchi MD.
Advocate Illinois Masonic Med.
Center** Dr.
Michael Friedman MD.
Advocate Illinois Masonic Med.
Center** Beverly Bohus RN, Nurse Manager Advocate Illinois Masonic Med.
Center** Lorel Hedges Nurse Practioner.
Advocate Illinois Masonic Med.
Center now works in Tennessee Uma Kelkar Director of Rehab Manor Care of Northbrook Jean Gavina Director of MDS, Manor Care
of Northbrook Elma Ramos RN , Evening Nursing Supervisor, Manor Care of Northbrook Contact information available upon request.

06/2009 to 07/2010
Company Name

Started out as a Supervisor but was promoted to DCD (Director of Care Delivery) managing a 40 bed Locked Dementia Unit and later a
60 bed Long Term Care Unit and recently back to the Dementia Unit along with the Long Term Care Unit.
Duties included: Leading the nursing unit, setting priorities, staff development ,upholding Corporate Standards, communicating through
existing information systems, and material management, Clinical Management: Infection control, QA, understanding Professional issues,
valuing every employee, supporting and leading company policies, attending interdisciplinary meetings twice daily, weekly and monthly
meetings such as Medicare meetings, investigation of all falls and skin injuries, and new admissions care planning.
Monthly Staff Meetings.
Assists with hiring and disciplinary actions.
Resigned July 2010 Want to take some vacation time, and to find a Long Term Care Management position somewhat closer to my home.

01/1977 to 01/2009
RN / Asst. Head Nurse Practice Leader Company Name ï¼​ City , State

Responsible for management of Unit on 24 hr basis including staffing, scheduling, and payroll.
Monitor staff of RN's, NCT's, and Unit Clerks for daily assignments on going learning needs, and occasionally fill staff RN voids.
Reported to Nurse Manager on daily basis for any additional tasks and to keep her current to Units activities and problems.
Helped Nurse Manager in interview process and in both disciplinary activity and in employee terminations .Sought out and scheduled in-
services for staff and made sure all staff attended required hospital mandatories yearly and when required.

01/1977 to 01/2009
Company Name ï¼​ City , State

Started nursing career as RN on general Med / Surg Unit for 2 years.
Recruited by MD Chairman of Oncology to be part of staff to open 1st Oncology inpatient Unit.
Promoted also to Assistant Head Nurse.
Worked there for next 20 years.
Earned OCN certificate.
Helped instruct all RNs on unit to become certified to mix Chemo drugs via Laminar Flow Hood and to administer drugs safely and monitor
for side effects and manage such symptoms.
Beside management duties was also responsible for taking a patient load on many days during the week.
In 1999 changed to Surgical / 23hr Observation Unit at Illinois Masonic Med Center as Staff RN.
After approximately 4 years promoted to Practice Leader,(equal to Asst.
Head RN ) Duties expanded as Computers installed to all Units.
Responsible for computer profiency and scheduling staff to Computer Classes and monitoring their progress in daily charting on patients.
Attended workshops to learn computer scheduling and payroll duties.
Attended 2 day seminar for PICC LINE insertion and management.
At one point headed the PICC LINE program for all the PICC RNs and kept the records for all PICCs placed in patients and any
complications and later problems, Became Nationally certified for Med / Surg Nursing after taking exam and passing.
Types of Surgical patients seen on thisUnit include Gyne, Urology, General Surgical, Trauma, Post SICU Head and Neck, General ENT
patients and Fetal Demises less than 20 weeks.
Due to the number of private rooms on the unit we also would take all types of Isolation including R/O TB into our Negative Air Flow
room.
Many of the patients were short stay anywhere from overnight to 2-3 days.
Some of the patients as overflow Medicals, Isolation, and the more extensive Head and Neck Surgical patients would stay 4-5 days or
more.
As a result this Unit was fast paced.
Many days up to half the unit would be discharged and within 1-2 shifts all the beds would be filled with new patients.
My main job on a daily basis was to manage placing patients correctly and to oversee assignment of competent staff to the types of patients
coming in.
I made frequent rounds to assure pt satisfaction and to quickly aid in preventing and problems from escalating.
I had to monitor staff learning needs and try to set up needed review or Unit based in-service and also try to send staff to outside learning
seminars as budget allowed.
On daily basis was responsible for checking"" State of the Unit "" printed daily and included all the areas of staff charting that was missing or
incorrect.
I would make sure all shifts of staff were aware of missing documentation and have them correct such or help them with correction as
needed.
Attended staffing daily to make sure last minute changes done and next two shifts had adequate staffing.

Education and Training
1976
RN Diploma Illinois Masonic School of Nursing ï¼​ City , State
1974
Northeastern Illinois University ï¼​ City , State
1973
Western Illinois University ï¼​ City , State
Additional Information

Awards received Dorothy Rome Nominee in 1999 ( Highest yearly award for Experienced RNs ) Awarded many ""Applause AwardsÂ´""
during the years at Masonic. ( A nominated award for Excellence ) Asked to Head up the PICC Line Program until turned over to
Interventional Radiology All of the above from Advocate Illinois Masonic Medical Center.

"
/content/drive/MyDrive/RecruitFlow/TestDataset/ADVOCATE/10659182.pdf,"SUBSTITUTE TEACHER
Professional Summary
A self-motivated, results oriented, and resourceful professional focused on delivering compassionate patient experiences; accompanied by
organizational, problem-solving, interpersonal, communications, and excellent customer service skills; and over 10 years in social services within
the health care family and community. In addition to being an advocate for promoting happy, healthy, and balanced individuals, I am proactive, and
adept at interacting effectively with the ability to multi-task effectively.
Core Qualifications

Critical thinker Understands medical procedures
Effectively Influences others Good written communication
Relationship and team building Medical terminology knowledge
Cultural awareness and sensitivity CPR (Certified)
Maintains Strict Confidentiality Certified CNA/HHA & Medical Assistant

Accomplishments

Received ""Award for Outstanding Performance"" as Housekeeping Manager for the cleanness Comfort Suites Inn Hotel in our region.
Received ""Awards for Deans list "" Acted as the department ""go-to"" person for challenging calls and clients.
Over ten years in volunteering in summer basketball camp and PADS homeless shelter.

Experience
Substitute Teacher Aug 2014 to Current 
Company Name ï¼​ City , State

Event Planner Jun 2013 to Current 
Company Name ï¼​ City , State

Filled in for absent teachers in emergency and on short and medium term assignments Followed teaching programs set by regular teachers
and prepared outlines when necessary Set and corrected homework assignment and projects Fostered safe, positive and supportive
learning environment Ensured good order and behavior in and out of class Respected confidentiality of information Adhered to non-
discriminatory policies and guidelines.

Provide personal catering event services to Health Fairs, Senior Community Events, Hospital Events, and Health Care CEO's and
Physicians Act as menu consultant for all food and beverage selections Arrange event dÃ©cor Oversee room set up, food preparation, and
other venue operations Act as on-site liaison between Your Way Catering and venue operations staff.

Medical Assistant/Hyperbaric Chamber Technician Apr 2011 to Mar 2013 
Company Name ï¼​ City , State

Responsible for recording patient vitals, i.e.
temperature, pulse and respiration rates, and blood pressure as well as patient examination room prep Responsible for cleaning and dressing
wounds Responsible for explaining treatment procedures to patients Accountable for collecting and preparing laboratory specimens
Responsible for regulating patient's oxygen levels during hyperbaric chamber therapy Familiar with practices, standard concepts, and
procedures Acquainted with performing necessary maintenance to systems; and operating and monitoring hyperbaric chamber other
hyperbaric support systems Responsible for using computerized applications for scheduling and various administrative duties.

Home Health Aide Sep 2004 to Jul 2009 
Company Name ï¼​ City , State

Assisted with resident bathing, grooming, meal prep, and medication management Responsible for recording resident's vitals, i.e.
temperature, pulse and respiration rates, and blood pressure Assisted with residence adaptability/transference to wheelchair and adaptive
equipment Monitored, and reported abnormalities and/or deviations in resident's health stats Provided safe and direct personal care to
residence as defined in the Home Care Aide program Fulfilled agency responsibilities by completing all required documents accurately and
timely Participated in all required agency meetings Identified and reported process improvements opportunities within the home in order to
enhance the quality of service provided.

Health Clerk Aug 2001 to Aug 2004 
Company Name ï¼​ City , State

Performed various administrative duties; and assisted in student registration Responsible for record keeping, appointment setting, greetings,
phones, and supply inventory Responsible for application of first aid treatment (if required) Administered medications to students with
mental disorders Monitored treatments as well as compiled data, and maintained student documents Conducted vision and hearing
screenings Interviewed parents for IEP meetings.

Education
Bachelor of Arts , Psychology /minor Social Work 2012 GOVERNOR STATE UNIVERSITY ï¼​ City , State Psychology /minor Social Work
Associate of Science , Psychology 2004 South Suburban College ï¼​ City , State Psychology
Skills

adaptive equipment, administrative duties, appointment setting, agency, blood pressure, CNA, consultant, CPR (Certified, first aid, Home Care,
team building, meal prep, Medical terminology, medication management, meetings, bathing, policies, quality, record keeping, recording, scheduling,
supply inventory, teaching, phones, therapy, vision, wounds, written communication

"
/content/drive/MyDrive/RecruitFlow/TestDataset/ADVOCATE/10818478.pdf,"EXPRESS SCRIPTS
Summary
Responsible and mature Retail Sales Consultant who thrives in fast-paced environments. Enjoys working as part of a team to achieve sales goals.
Accomplishments

Fulfilled all supervisory duties when Store Manager was on vacation.
Named ""Employee of the Month"".
Received numerous â€œexceeds expectationsâ€​ ratings on performance reviews.
Met monthly sales goals for numerous months.
Supervised team of three staff members.

Experience
Express Scripts 
September 2015 to Current Company Name ï¼​ City , State

Exercises sound judgment in issuing credits and making exceptions to customer policies to maintain high levels of customer satisfaction.
Fielded an average of [number] customer service calls per day.
Managed wide variety of customer service and administrative tasks to resolve customer issues quickly and efficiently.

Prime Communication (AT&T Authorized Retailer) 
January 2015 to September 2015 Company Name ï¼​ City , State

Created strategies to develop and expand existing customer sales, which resulted in a 20% increase in monthly sales.
Initiated daily store counts, orders and acquired proper products
Maintained knowledge of current promotions, policies regarding payment and exchanges, and security practices.

Radio Shack 
November 2013 to January 2015 Company Name ï¼​ City , State

Operated a cash register to process cash, check and credit card transactions.
Computed sales prices, total purchases and processed payments.
Described merchandise and explain operation of merchandise to customers.
Replenished floor stock and processed shipments to ensure product availability for customers.
Facilitated monthly and quarterly physical inventory counts.
Administered all point of sale opening and closing procedures.
Opened and closed the store, including counting cash, opening and closing cash registers and creating staff assignments.
Worked as a team member to provide the highest level of service to customers.
Maintained friendly and professional customer interactions.

Education
High School Diploma : Business/ Computers Camden County High School ï¼​ City , State
Skills

Administrative
Cash handling
Excellent communication
interpersonal skills
Detail-oriented merchandising
Self-motivated
70 WPM

"
/content/drive/MyDrive/RecruitFlow/TestDataset/ADVOCATE/11963737.pdf,"SENIOR CLIENT ADVOCATE II
Accomplishments

Earned the Workgroup for Electronic Data Interchange (WEDI) Award of Merit 2 years in a row for educating the health care industry on
electronic claims attachments.
Affiliations.
Health Level Seven (Standards Developing Organization) knowledge of V2 messages, Fast Healthcare Interoperable Resources (FHIR)
and the Meaningful Use electronic health record standard Consolidate Clinical Document Architecture.

Summary
Motivated Business Analyst with the technical expertise and business acumen necessary to translate business requirements and objectives into
scalable, highly resilient and successful system solutions.
Skills

Data analysis Business artifacts documentation
Strategic planning Business development
Team player Workflow analysis
Product launches Brand management
MS Project SQL and databases
Risk mitigation and management Data mapping
Service-oriented architecture Release planning
Collaboration tools Test case scenarios
Requirements gathering Gap analysis

Experience
12/2002 to 12/2017
Senior Client Advocate II Company Name ï¼​ City , State
SuppCRAIG Gabron

CRAIG Gabron orted BlueCross BlueShield of South Carolina's TRICARE (Military Health Insurance) line of business functioning in an
analyst role.
This position required an ability to work in a matrix environment across cross-functional teams and the ability to produce results in a highly
dynamic and formative environment.
Duties and responsibilities included: Documented business processes and analyzed procedures to see that they would meet changing
business needs.
Assessed the impact of current business processes on users and stakeholders.
Conducted interviews with key business users to collect information on business processes and user requirements.
Identified process inefficiencies through gap analysis.
Increased annual revenue by 5% by recommending improvements in efficiency for routine pricing updates.
Performed TRICARE bench marking analysis and identified savings opportunities and potential product enhancements.
Researched and resolved issues regarding extracting data from a clinical EHR for HEDIS measure calculation for two HEDIS measures,
Colorectal Cancer Screening (COL) and Controlling Blood Pressure (CBP).
Implemented user acceptance testing with a focus on documenting defects and executing test cases using HP's Application Lifecycle
Management tool.
Managed testing cycles, including test plan creation, development of SQL scripts and co-ordination of user acceptance testing.

12/2002 to 12/2017
Senior Client Advocate II Company Name ï¼​ City , State

Managed the relationship between the Health Net, BlueCross Operations and BlueCross Information Systems Application areas with ten
direct reports.
Optimized and managed research and development spending through collaboration with key business leaders.
Trained four new employees on accounting principles and company procedures.
Created periodic reports comparing budgeted costs to actual costs.
Suggested budgetary changes to increase company profits.
Provided timely actuals, forecast and budget data for IT and corporate management.
Worked with management at the project level to ensure expense plans are achieved.

03/1992 to 11/1996
Manager Information Systems City , State

Managed the relationship with Cable and Wireless Communications in London, England on the installation of a telecom billing system,
leading a team of 12 analysts and programmers in the analysis, design and coding of the international telecommunications commercial billing
software.
Gathered detailed use cases and requirements through regular on-site visits, virtual meetings and customer advisory board sessions.
Translated business goals, feature concepts and customer needs into prioritized product requirements and use cases.
Collaborated with the sales, marketing and support teams to launch products on time and within budget.

Coached and mentored twelve new staff members, including conducting performance reviews.
Led communication with stakeholders regarding product goals and progress made.
Tested and implemented new technology-based global projects such as international telephone billing system.
Created innovative and intuitive product features such as a packetize billing system.

Education and Training
1976
Bachelor of Science : Health and Physical Education Computer Science and Information Technology Computer Science Slippery Rock University
of Pennsylvania Northampton Community College ï¼​ City , State Health and Physical Education Computer Science and Information Technology
Magna Cum Laude Computer Science
1980
Computer Science Computer Science
Skills
billing system, Blood Pressure, Brand management, Business development, business processes, Cancer, Data analysis, sales, SQL,
telecommunications, telecom

"
/content/drive/MyDrive/RecruitFlow/TestDataset/ADVOCATE/11773767.pdf,"BENEFIT ADVOCATE SUPERVISOR
Summary
Represent a reputable company as an Underwriter, proving my value by building and supporting a healthy and profitable book of business.
Highlights

Licensed Property, Casualty, Life and Disabilty Insurance Agent in Washington.
Technical and Soft Skill Coaching, Supervising, Coverage Counseling, Training.
Development of Training Materials, Workflows, Procedures, SharePoint Sites, Wiki Pages,
Quality Assurance Programs, Form Letters and Newsletter Articles.
Problem Solving, De-Escalations, Employee Development, Quality Assurance
Work Force Management, Time Keeping, Vacation Scheduling, Attendance and
Schedule Adherence Coaching, Hiring, Employee Onboarding and Termination.
Customer Care, Front-Line Underwriting, Needs Analysis, Cross Selling,
Up Selling, Endorsing Policies, Billing Analysis, Collaboration, Project Management.
Proficient with MS Windows, MS Office, Applied Epic, Vertafore Sagitta / BenefitPoint, CC Pulse,
Verint Impact 360, Verba, Kronos, MyTime, DocuSign, Taleo, Cisco Enterprise/Finesse/Admin/Report Server, SalesForce Service
Cloud and more.
Running reports, analyzing and organizing data in Excel using pivot tables.
Experience with products and services of a multitude of insurance carriers, including but not limited to American Modern, Chubb,
Dairyland, Foremost, Kemper, RLI, Mapfre,
MetLife, Mutual of Enumclaw, PersonalUmbrella.com, Progressive, Safeco, Travelers, Premera Blue Cross, Regence Blue Shield, United
Healthcare, Aetna, Cigna, Kaiser Permanente, Group Health, Symetra, Unum, Delta Dental, Willamette Dental and VSP.

Experience
Benefit Advocate Supervisor 
May 2014 to Current Company Name ï¼​ City , State

Provide guidance and direction to a team of Licensed Life and Disability Benefit Advocates Present and promote Benefit Advocate services
to both internal and external prospects.
Assist Consultants and Client HR with advanced needs, sensitive and escalated issues.
Provide guidance and assistance on insurance questions, client relations, carrier issues, guidelines, technical support and more.
Coordinate daily operations, manage schedule and attendance adherence.
Coach and train advocates on systems, benefits, carrier guidelines and soft skills.
Conduct regular quality assurance, one-on-one's, performance reviews and team meetings.
Monitor department service levels to ensure that quality customer service is maintained.
Perform the work of Benefit Advocate during peak periods and take call escalations.
Implement new systems and improve processes to create efficiencies.

Customer Service Supervisor 
November 2011 to May 2014 Company Name ï¼​ City , State

Coach and provide guidance to 14 Licensed Property & Casualty Customer Service Agents Coordinate daily operations, manage schedule
and attendance adherence.
Support training and reinforce process recommendations aimed at developing a high performance team with an emphasis on account
management and sales support.
Conduct regular one-on-one's, performance reviews and team meetings.
Monitor department service levels to ensure that quality customer service is maintained.
Provide guidance and assistance on Insurance questions, customer relations, carrier issues, underwriter guidelines, technical support and
more.
Act as Hiring Manager, seeking talent, organizing interviews and making hiring decisions.
Side by Side and remote monitoring for quality, performance and adherence purposes.
Perform the work of customer service agent during peak periods and take call escalations.
Create and represent the department on special projects/initiatives.

Customer Service Lead 
September 2005 to October 2011 Company Name ï¼​ City , State

Assist department supervisors with the coaching, training and mentoring of Customer.
Service Agents.
Monitor department productivity, take escalated calls, answer questions.
and provide assistance to co-workers.
Take 40+ calls per day, assisting insured's and.
agents with policy billing and servicing needs.
Take on projects as needed.

Education
Bachelor of Social Sciences : 2009 University of Washington Law, Gender and Ethnicity The National Alliance for Insurance Education and

Research Current Certified Insurance Councilor - Agency Management, Life & Health, Commercial Property Goal to complete Personal Lines
and Commercial Casualty by the end of the year 2016 to earn my CIC designation.
Skills
account management, Agency, benefits, Billing, Cisco, Coach, Coaching, com, Counseling, Client, client relations, customer relations, Customer
Service, Customer Care, direction, Hiring, HR, Insurance, Kronos, Law, Letters, meetings, mentoring, Excel, MS Office, SharePoint, MS
Windows, Needs Analysis, Enterprise, Newsletter, organizing, peak, performance reviews, pivot tables, Policies, Problem Solving, improve
processes, Project Management, quality, quality assurance, Research, Selling, sales support, Scheduling, Supervising, technical support, Employee
Development, Training Materials, underwriter, Underwriting, Articles

"
