PDF File Name,Parsed Text
/content/drive/MyDrive/RecruitFlow/TestDataset/ACCOUNTANT/12065211.pdf,"SENIOR ACCOUNTANT
Professional Summary
Senior accountant who completes accounting activities with accuracy and speed with extensive experience in full life cycle of general ledger
accounting
Skills

Aderant/CMS
Excel
QuickBooks Pro
SQL
AccessÂ 
Peachtree
Hyperion

Financial reporting
US GAAP principles
IFRS
Bookkeeping
Budget development
Individual tax returns
Essbase

Work History
Senior Accountant Mar 2006 - Current 
Company Name City , State 

Reconcile various balance sheet accounts not limited to cash and liability accounts, including bank statements, for the purpose of maintaining
the accuracy of the general ledger in accordance with cash, GAAP, and various international tax legislative basis.
Perform the primary liaison function for the interim and annual audits performed by Deloitte.Â 
Perform assigned schedules for interim and annual audits.Â 
Assist auditors with understanding of firm's internal controls which include revenue and expenditure cycle. Â 
Review and analyze journal entries from the original accounting source and if a variance from the general ledger is found, initiate discussions
with specialists in accounts receivable, accounts payable, payroll, and tax department to resolve the discrepancy.
Review and analyze international payrolls inÂ aspect of income tax, local tax, consumption tax, and fringe benefit deductions for Seoul,
Shanghai, and Tokyo office and upload into Aderant/CMS for posting into the general ledger.
Analyze and reconcileÂ value added tax for Vienna and Seoul office
Resolve currency fluctuation issues and record gains/losses related to currency exchange rates for the international offices of the firm by
using currency mode journal entries.
Analyze expatriate expenditures on monthly basis to be reported on W-2 form.
Prepare initial K-1 schedules to be filed by tax department
Prepare month-end various accrual journal entries including base wage, bonus, occupancy, prepaid property insurance, telecommunications,
and catering accruals.
Prepare and analyze expense allocations from firm general to local offices on a monthly basis.
Review and analyze inter-company transactions for Seoul, Shanghai, Tokyo, and Vienna office
Prepare monthly financial statements, which are shared with the partners and management of the firm.
Assist in translation of various fixed asset invoices from Seoul and Tokyo office and other Asian offices' travel expense reports.
Notable accomplishments: Found material misstatement in prepaid property insurance for the first quarter of '08 and made prospective
adjustments to the related general ledger accounts.
Provided clarity in Japanese payroll systems associated with health, welfare, and childcare allowance to the management and made
prospective adjustments to the related general ledger accounts.

Accountant Jan 2005 - Mar 2006 
Company Name City , State 

Maintain financial records in accordance with GAAP to be reported to a parent company and investors.
Analyze & reconcile G/L accounts and prepare semi-annual, and end year B/S, I/S, and statement of cash flows Coordinate with
warehouse manager to ensure daily shipping schedules.
Communicate with outside company's designated CPAs when tax issues arise.
Establish master employee payroll record file for information entry into payroll system.
Receive & compute hours, make deductions for 401K, health insurance, and other adjustments thru Paychex Prepare loan applications and
maintain factoring arrangements with A/R schedule.
Assist in training, guidance and coordination of accounts payable, accounts receivable, and other departments and site personnel.
Performed semi-annual inventory valuation.

Financial Analyst Aug 2002 - Jan 2005 
Company Name City , State 

Manage and forecast funds for Palm Desert National Bank sponsored 350 ATM terminals averaging 2.5 million on a weekly basis.
Reconcile & settle, and act as lead accountant for Innobeta Systems, Inc., (affiliate of Money Marketing, Inc.).
Prepare monthly Profit and Loss reports as to surcharge and interchange.
Analyze communication and armor carrier expenses as a temporary M&A team member during due diligence procedure of ATM World
Corp.
Analyze processing costs and network fees in terms of EFTs.
Prepare audit work papers, confirmations and other documentation to make the audit efficient and hold on audit fees in connection with
annual audit.

Perform analysis of general ledger accounts; prepared journal entries and adjustments to facilitate closings.
Assist in the preparation of full financial statements and footnotes for investors and lenders.
Review work of staff and operations to assure that certain daily procedures and reconciliations were performed routinely according to
policies and procedures.
Translate and prepare documents pertaining to defective parts of ComNet ATM Series assembled and distributed by Nextran Industries, a
subsidiary company of Chungho ComNet Co., Ltd.
Consult private investors and customer services.

Education
Bachelor of Business Administration : Accounting August 2002 
TEMPLE UNIVERSITY City , State 
Accounting Audit Project: ""Identifying potential risks that would impact the audit of Xerox Corp."" Select Courses: Advance Accounting,
Accounting Information System, Auditing & Assurance Services, Taxation
Interests

World travel/Photography/Golf/Soccer/Movie/Fashion

Certifications

Additional Information

Certified Public Accountant, New York State, Date of issued: 03/04/2015, License number: 117205

Activities: Vice President, APS (Accounting Professional Society) at Temple University, 2001 - 2002

"
/content/drive/MyDrive/RecruitFlow/TestDataset/ACCOUNTANT/12338274.pdf,"ACCOUNTANT
Summary
To pursue excellence in the dynamic business world by obtaining a placement allowing me to perform in an environment where honesty, sincerity &
a positive attitude would be valued. I would like to take up a challenging job to nourish my qualification , expertise & experience within a reputed
organization & further enhance my performance. Flexible [Job Title] who adapts seamlessly to constantly evolving accounting processes and
technologies. Flexible [Job Title] who adapts seamlessly to constantly evolving accounting processes and technologies.
Highlights

Dos , Windows 9.x , XP, MS Office, Oracle, Tally, Adobe Photoshop , Adobe Illustrator, Pagemaker, 3d Inifnative,
Audio Editing, Video Editing , Macro Media Director, Oracle 8I, Developer 2000.

Account
reconciliations

Accomplishments
Enter outstanding achievements that show you can go above and beyond basic job expectations. See Examples General Ledger Accounts

Maintained accurate accounts including cash, inventory, prepaid, fixed assets, accounts payable, accrued expenses and line of credit
transactions.

Experience
October 2011
to
August 2015
Company Name City , State Accountant

January 2009
to
September 2011
Company Name City , State Accountant

April 2006
to
May 2007
Company Name City , State Accountant

October 2001
to
March 2006

Prepared monthly and annual expense forecasts, including any necessary recommended action required to manage costs to achieve budget.
Performed debit, credit and total accounts on computer spreadsheets/databases, using specialized accounting software. Responsible to
ensure that receivables are timely collected, Participate in preparation of Monthly Management reports, Stock taking, monthly, quarterly and
yearly and running reports for inventory control and analysis, Inspection and follow up of warehouse for stock movement.
Review of taxation documents and applications for clients, Preparing for cost analysis and variance reports, and supporting management in
cost modeling and overhead cost allocation, Processing for final payment for suppliers and staff.
Assisting management in Budget preparation, Checking of proper documentation before payment disbursement.
Reconciliation of Bank Statements, staff account and supplier accounts, Financial ratios and analysis report of the same, Making MIS report
for CFO and senior Management, Coordinating with other departments for financial management.

Reviewed accountantÃ†s book entries to ensure accuracy of the G/L. Responsible to ensure that receivables are timely collected,
Participate in preparation of Monthly Management reports, Stock taking, monthly, quarterly and yearly and running reports for inventory
control and analysis, Inspection and follow up of warehouse for stock movement.
Preparing for cost analysis and variance reports, and supporting management in cost modeling and overhead cost allocation, Maintaining
staff accounts and processing staff salary, leave, and final settlement in timely manner after checking of documents and auditing of the same.
Processing for final payment for suppliers and staff, Processing and review of tax documents, Assisting management in Budget preparation,
Checking of proper documentation before payment disbursement, Liaising with HR and suppliers for payroll and other disbursement.
Reconciliation of Bank Statements, staff account and supplier accounts, Financial ratios and analysis report of the same, Giving guidance
and support for general staff for payroll and finance, Making MIS report for CFO and senior Management, Coordinating with other
departments for financial management.
Aug'07- Dec'08 Auto1 (Al-Ghannam Auto World Co.
WLL), Kuwait Accountant: Responsible to ensure that liabilities are paid on time and receivables are timely collected, Participate in
preparation of Monthly Management reports, Maintaining accounts on daily basis, Stock taking and inventory report as well as warehouse
inspection, Preparing and disbursing salary and leave to staff after checking of proper documentation, Reconciliation of Bank Statements,
MIS report for senior management.

Received, recorded, and banked cash, checks, and vouchers as well as reconciled records of bank transactions. Responsible for payable
are paid on time and receivables are timely collected, Ensures Co.
policies related to payments, and contracts are completely followed.
Preparing payroll for staff, Preparation of Financial Statements.

Company Name City , State Account Assistant

Performed debit, credit and total accounts on computer spreadsheets/databases, using specialized accounting software. Maintaining
Accounts on daily basis up to finalization, Follow up Accounts receivables and daily reporting to the Management, Preparation of Inventory
Reports, Sales Invoices , Purchase Invoices and all accounting Vouchers of debit & credit.
Sep' 2K- Sep'01 Digital Vish Computers, Udaipur (Raj.) India.
Maintaining Cash books and Journal book and reconciliation of bank accounts, Preparation of Cash Vouchers & handle petty cash, Daily
routine banking works etc.

Education
2006
Vidyasagar University City , State , India MBA : Finance Finance
2000
Mohan Lal Sukhadia University City , State , India Select...
Skills
3d, accounting, Accountant, Accounts receivables, Adobe Illustrator, Adobe Photoshop, Pagemaker, Audio Editing, auditing, banking, book,
Budget preparation, contracts, cost analysis, credit, clients, debit, Dec, documentation, Dos, senior Management, finance, Financial, financial
management, Preparation of Financial Statements, HR, Inspection, Inventory, inventory control, Macro Media Director, MS Office, 2K,
Windows 9.x, works, MIS, modeling, Developer 2000, Oracle 8I, Oracle, payroll, policies, reporting, Sales, tax, Video Editing
Affiliations
Enter any professional organizations that you are involved in.
See Examples

"
/content/drive/MyDrive/RecruitFlow/TestDataset/ACCOUNTANT/12802330.pdf,"LEAD ACCOUNTANT
Highlights

QuickBooks, Peachtree, In-house Accounting Systems and Financial Reporting, MAS 90, FAR, WAWF, Great Plains, Integration
Manager, FRx reporting.
Hyperion Workspace, Planning, Enterprise, Essbase, Schedules and Reports, Crystal Reports, MS Office with strong Excel skill
Financial Accounting
Database Management
Budget Administration
Performance Reporting
Tax Preparation and Compliance
Forecasting/Trend Analysis
Strategic Planning
Cash-Flow Analysis
Variance Analysis
Sarbanes-Oxley Research and Compliance

Experience
Lead Accountant 
November 2011 to Current Company Name ï¼​ City , State

Experience in various areas including, but not limited to: operating budgets, financial analysis/planning, financial statements and reporting,
accounting policies and procedure, cash flow, taxes, auditing, and business process improvements.
Manage various areas in financial accounting, budgeting and financial analysis.
Execute qualitative and quantitative analysis techniques to minimize risks and liabilities.
Develop and implement system processes to achieve financial discipline and improve the overall efficiency of the organization.
Provide strong analytical skills, good relationship management and negotiation skills in liaising with various large corporate entities, financial
institutions and various regulatory authorities.
Monitor and manage daily processes for multiple complex revenues streams.
Review contracts for new pricing schedules while researching and implementing new accounts into the accounting systems.
Provide subject matter expertise in analyzing revenue trends and apply corrective measures to risk findings.
Maintain ongoing communication with key stakeholders to include accounts, operations managers and new markets support teams for
emerging accounting issues and recommend corrective actions.
Test internal controls for compliance in preventing fraud and improving accounting processes while meeting full compliance with GAAP,
Federal and State law.
Stay abreast of relevant new market events and new product in the pipeline.
Track daily activity of the firm's new contracts and provide recommendations on financial related issues.
Maintain the accuracy and completeness of all deferred revenues and enforce timely revenue recognition.
Lead and develop methods and implement revenue test models for complex billing structures.
Perform trends analysis on revenues using quantitative methodology and forecast future contingencies.
Maintain the new revenue backlog inventories and periodically testing for appropriateness against new pricing conditions as well as
accounting policy determinations.
Identify risky accounts in default and communicate to account managers for corrective actions.
Prepare various ad hoc reports upon request by senior management requiring knowledge of general ledger and supporting sub-ledger
details.
Lead, support, and assist the external financial audit process.
Prepare and maintain various incentive payment schedules for the prescriber program.
Lead and support the billing automation effort while streamlining the monthly billing process for more prompt, accurate and timely billing of
our customers.
Improve cash flows by meeting targeted projections.

Senior Accountant 
September 2006 to October 2011 Company Name ï¼​ City , State

Compiled and analyzed financial data used in the preparation of corporate financial statements.
Provided support to business operations through analysis of key performance indicators and trends.
Maintained and supervised the various systems of internal controls over financial reporting while assessing and remediating deficiencies
discovered through periodic testing making easier to reconcile accounts.
Collaborated, compiled, and prepared budgets and forecast operational activities.
Maintained general ledger and sub ledger accounts by posting and documenting financial journal entries.
Managed and maintained corporate closing schedules for periodic financial reporting.
Monitored and maintained fixed assets and depreciation schedules on ongoing basis.
Filed property taxes with county and ensured compliance of corporate sales taxes with Federal and State.
Lead team in the preparation and coordination of the financial audit process.
Reconciled bank statements and procured recommendations for all bank irregularities issues with key stake holders.

Staff Accountant 

March 2006 to August 2006 Company Name ï¼​ City , State

Performed monthly closing cycle, responsible for preparing, analyzing, reconciling and correcting financial statements and management
reports for the homebuilding divisions.
Acted as the primary contact for operations' personnel for any accounting-related matters.
Maintained the company's systems of internal controls over financial reporting.
Posted financial statement entries; including reconciling and documented P & L re-classification entries.
Verified preliminary sales report and composed final corporate reporting.
Reviewed and reconciled inventory status and posted reconciling entries.
Prepared and corrected preliminary escrow analysis, including extensive analysis of escrow account allocation entries.
Performed analysis of direct profits.
Reviewed and created roll forward reports of builder's reserve runs summary.
Reconciled builder proceeds with mortgage proceeds.
Researched accounting procedures, policy and statures, including Sarbanes-Oxley, SEC compliance, IRS, state and local tax laws.

Education
BS : Accounting Business Administration , 2005 University of Maryland University College ï¼​ City , State Accounting Business Administration
CPA Candidate
Skills
accounting, Accounting Systems, ad, analytical skills, auditing, automation, billing, budgeting, budgets, Budget, business operations, business
process, Cash-Flow, cash flow, closing, contracts, CPA, Crystal Reports, Database Management, Essbase, senior management, financial,
Financial Accounting, financial analysis, financial analysis/planning, Financial Reporting, financial statements, fixed assets, Forecasting, general
ledger, Great Plains, Hyperion, inventory, ledger, law, market, MAS 90, Excel, MS Office, negotiation, Enterprise, Peachtree, personnel, policies,
pricing, processes, quantitative analysis, QuickBooks, reconciling, relationship management, reporting, researching, Research, sales, Sarbanes-
Oxley, Strategic Planning, Tax Preparation, tax, taxes, Trend

"
/content/drive/MyDrive/RecruitFlow/TestDataset/ACCOUNTANT/11759079.pdf,"SENIOR ACCOUNTANT
Experience
Company Name June 2011 to Current Senior Accountant 
City , State

Prepare quarterly and annual financial statements for 17 multi-family communities for distribution to investors and financial institutions.
Reconcile and account for all activity on the income statement and balance sheet including cash, fixed assets, derivatives, equity, and
property debt.
Coordinate and review work of external audit firms.
Initiate capital calls and distributions for investors.
Manage budgets and construction loan activity for approximately $100,000,000 in active construction projects in FL, MA, and MD.

Company Name March 2010 to June 2011 Associate Fund Controller 
City , State

Performed quarterly and annual close procedures for MSREF (Morgan Stanley Real Estate Funds) 6I, the largest international real estate
investment fund to date with $8 billion of partnership assets, and draft financial statements distributed directly to fund investors.
Lead quarterly management fee process by performing work to draft approximately $14,000,000 in bills to fund Partners.
Develop work plan to ensure deadlines are met, test results, delegate work to other Fund Controllers, and perform detailed review of their
work.
Lead MSREF 6I initiative to implement reinvestment of proceeds (ROP) methodology to reallocate approximately $120,000,000 in cash
to-date amongst investments with deficient cash balances to cover contributions and expenses.
Write formulas to analyze cash movement in Microsoft Excel and assist four Information Technology Vice Presidents in programming the
partner capital sub ledger system to calculate the movement and test results.
Wrote standard operating procedures memo for ROP to train team members.

Company Name June 2007 to March 2010 Advisory, Forensic and Audit Associate 
City , State

Performed research to locate red flags in numerous potential fraudulent mortgages at one of the largest bank failures in U.S.
history.
Developed writing skills by drafting over forty memorandums that summarized potential fraud in loans that were presented to multiple
agencies of the Government.
Wrote a thirty-five page corporate intelligence narrative explaining personal and Professional relationships of an individual under
investigation.
These tasks assisted the FBI in arresting the individual, suspected of orchestrating a two billion dollar mortgage fraud scheme.
Performed substantive test work, analytical procedures, and testing of controls at multiple audit clients, including leading the sales and
inventory test work of an international company with approximately one billion in annual sales.
Audited cash, receivables, investments, inventory, payables, property, debt, equity, revenue, cost of goods sold, and expenses.
Analyzed audit client's major accounting processes, identified control weaknesses, and recommended solutions and improvements.
Worked on multiple phases, including fraud investigations and data analytics, of a high profile engagement involving the largest natural
disaster relief fund in United States history and was the first to analyze, discuss, and research a series of fraud allegations received from an
anonymous telephone hotline that lead to a new, lasting client relationship with the Federal government.
Analyzed a series of bank accounts owned by over twenty customers of a large, domestic bank to determine the amount of funds stolen and
trace illicit transfers made by a bank employee from each account in a multi-million dollar fraud scheme.

August 2006 to May 2007 Accounting Tutor Sole Proprietorship 
City , State

Held private sessions to teach financial accounting to over 25 individual client needs and wrote practice questions which resulted in grade
improvement amongst all clients, including one who increased his exam performance by 35 percentage points after sessions.

Education
EMORY UNIVERSITY, Goizueta Business School 5 2007 Bachelor of Business Administration : Accounting City , State GPA: GPA: 3.63/4.0
GPA: 3.77/4.0 Accounting GPA: 3.63/4.0 GPA: 3.77/4.0
Interests
Fulton County CASA Board of Directors Member, Treasurer. Plan fund raisers, review budget and financial statements, and supervise CASA
staff in not-for-profit organization that trains volunteers to mentor children being pulled from their homes through the Fulton County court system
for abuse and neglect. CPA, Hold an active Georgia license and scored between 87 and 93 out of a possible 99 on each of the four sections of the
CPA exam. CFE, Certified Fraud Examiner, which
Skills
accounting, balance sheet, budgets, client, clients, derivatives, drafting, equity, financial, financial accounting, financial statements, fixed assets,
Funds, Government, Information Technology, inventory, investments, ledger, MA, Microsoft Excel, natural, page, payables, processes,
programming, Real Estate, research, sales, scheme, telephone, writing skills
Additional Information

COMMUNITY SERVICE, CERTIFICATIONS AND AWARDS Fulton County CASA Board of Directors Member, Treasurer. Plan

fund raisers, review budget and financial statements, and supervise CASA staff in not-for-profit organization that trains volunteers to mentor
children being pulled from their homes through the Fulton County court system for abuse and neglect. CPA, Hold an active Georgia license
and scored between 87 and 93 out of a possible 99 on each of the four sections of the CPA exam. CFE, Certified Fraud Examiner, which
requires passing four exams and two years work experience in preventing and detecting fraud. Recipient, 2007 John R. Jones Accounting
Award. Given annually by vote of Emory University Professors to recognize the top performing senior year student in academia, community
involvement, and character. Recipient, 2006 Ben Pius Award. Awarded by Emory Professors to recognize exceptional achievements by the
highest performing junior year accounting student at Emory University.

"
